url,heading,content,category,tags
https://www.vogue.pl/a/najlepsze-filmy-2005-roku-do-ktorych-wciaz-wracamy,"Najlepsze filmy 2005 roku, do których wciąż wracamy","2025 rok w kinie zapowiada się bardzo obiecująco. A co oglądaliśmy dwie dekady temu? Oto 10 najlepszych filmów, które miały premierę w 2005 roku.
## „Duma i uprzedzenie”: Stylowy romans
Choć trudno w to uwierzyć, jedna z najbardziej stylowych ekranizacji powieści Jane Austen trafiła do kin 20 lat temu. Kultowy dziś film opowiada o Elizabeth Bennet (Keira Knightley), która zakochuje się ze wzajemnością w panu Darcym (Matthew Macfadyen). Na ich drodze do szczęścia stają jednak społeczne konwenanse, bariery i uprzedzenia. „Duma i uprzedzenie” zasługuje na ponowny seans także ze względu na eleganckie kostiumy Jacqueline Durran.
## „Tajemnica Brokeback Mountain”: Wzruszająca historia
Ennis Del Mar i Jack Twist (w rolach głównychHeath LedgeriJake Gyllenhaal) mają żony, dzieci, domy. Mimo to zakochują się w sobie bez pamięci. Ale jako że przyszło im żyć w latach 60. XX wieku w Wyoming, ich miłość nie może się spełnić. W kontekście wciąż nierównych praw osób LGBT+ oscarowy film wciąż oglądamy z ukłuciem w sercu.
## „Pan i pani Smith”:Mission Impossible
Angelina Jolie i Brad Pittjako małżeństwo płatnych zabójców? Ten film był skazany na sukces. Popularna produkcja śledzi losy tytułowych państwa Smithów, którzy od lat prowadzą podwójne życie. Za dnia udają wzorowe małżeństwo z amerykańskich przedmieść, a nocami polują na największych przestępców. Gdy ważna misja nie idzie po ich myśli, otrzymują zlecenia… na samych siebie.
## „Harry Potter i Czara Ognia”: Turniej Trójmagiczny
Choćczwarta część sagi „Harry’ego Pottera” nie należy do naszych ulubionych, to w 2005 roku nie mogło nas zabraknąć na kinowej premierze filmu. „Czara Ognia” jest naładowana akcją – mamy tu Mistrzostwa Świata w Quidditchu, Turniej Trójmagiczny z udziałem innych szkół magii i wielki powrót Voldemorta. Na potrzeby produkcji powieść została okrojona do niezbędnego minimum. Na szczęście nie zabrakło naszych ulubionych momentów, jak Yule Ball (i wielkie wejście Hermiony) czy wszystkie sceny z udziałem Cedrica Digorry’ego (w tej roliRobert Pattinson).
## „Stowarzyszenie Wędrujących Dżinsów”: O przyjaźni
„Stowarzyszenie Wędrujących Dżinsów” to wciążjeden z najlepszych filmów na seans z przyjaciółkami. Akcja filmu rozpoczyna się w momencie, gdy cztery przyjaciółki (Blake Lively, America Ferrera, Alexis Bledel i Amber Tamblyn) kupują jeansy, które idealnie pasują na każdą z nich. Tytułowe spodnie symbolizują łączącą je więź.
## „Constantine”: Mroczne oblicze Keanu
Adaptacja bestsellerowego komiksu opowiada o przystojnym łowcy demonów (w roli głównej oczywiścieKeanu Reeves) przemierzającym wygenerowane komputerowo Miasto Aniołów. W przeciwieństwie do „Matrixa” po efektach specjalnych widać, że powstały przed 20 laty. Samą historię, podobnie jak kreację Reevesa, nadal śledzi się zaskakująco dobrze. „Constantine” spodoba się w szczególności fanom fantasy.
## „Wyznania gejszy”: Kreacje z epoki
Nagrodzony trzema Oscarami film opowiada historię legendarnej gejszy Sayuri (Ziyi Zhang), wielbionej przez najpotężniejszych mężczyzn Japonii w latach 30. XX wieku. Na potrzeby „Wyznań gejszy”kostiumografka Colleen Atwoodinspirowała się tradycyjnymi strojami epoki. Do produkcji warto powrócić dla świetnej Michelle Yeoh, która wystąpiła niedawno we„Wszystko wszędzie naraz”.
## „V jak Vendetta”: Bunt na sprzedaż
Adaptacja komiksu w reżyserii Jamesa McTeigue’a opowiada o dystopijnej przyszłości Wielkiej Brytanii, w której panuje reżim totalitarny. Rząd tyranów planuje obalić tajemniczy V (Hugo Weaving). Pewnego dnia uwalnia z rąk policji Evey Hammond (Natalie Portman), która postanawia pomóc mu w jego misji. To dla tej roli aktorka zdecydowała się zgolić głowę, a maska V z czasem stała się symbolem międzynarodowej społeczności hakerów z grupy Anonymous.
## „Opowieści z Narnii: Lew, czarownica i stara szafa”: Baśnie i bajki
Zanim do kin trafią „Opowieści z Narnii”Grety Gerwig, warto przypomnieć sobie to podejście do ekranizacji sagi C.S. Lewisa. W 2005 roku do kin trafiła pierwsza część przygód czwórki rodzeństwa – Piotra, Zuzanny, Edmunda i Łucji – które znajduje fantastyczny świat w starej szafie. W Narnii dołączają do walecznego lwa Aslana i jego stronników, którzy chcą zakończyć rządy bezwzględnej Białej Czarownicy (doskonałaTilda Swinton).
## „Madagaskar”: Klasyka gatunku
Jedna z najlepszych animacji studia DreamWorks kończy w tym roku 20 lat. Przygody Alexa, Martiego, Glorii i Melmana w ogóle się nie zestarzały. Po części za sprawą polskiego dubbingu, który uczynił z bajki dla dzieci rozrywkę dla całej rodziny.","Kultura, Kino i TV","filmy, najlepsze filmy, Julia Właszczuk"
https://www.vogue.pl/a/czym-jest-the-apt-zagladamy-do-galerii-sztuki-i-designu-w-samym-sercu-barcelony,W niezwykłej przestrzeni The Apt w Barcelonie design spotyka się ze sztuką,"Usytuowany w samym sercu Barcelony The Apt, wymyślony przez Elisabeth Herzog, to więcej niż tylko klasyczna katalońska rezydencja – to rozwijający się dialog między sztuką, designem a przestrzenią prywatną. Ten innowacyjny koncept redefiniuje sposób, w jaki odbieramy wnętrza, łącząc kreatywną wizję z eksperymentalnym podejściem do projektowania.
## Różnorodność perspektyw, wspólna wrażliwość
The Apt podważa konwencjonalne zasady działania przestrzeni prywatnej, prowokując do refleksji nad tym, gdzie kończy się funkcja użytkowa, a zaczyna sztuka. Ten butikowy apartament na pograniczu domu i studia zajmuje 160 metrów kwadratowych, a jego starannie zaprojektowane wnętrza obejmują pięć prywatnych pokoi, w których design vintage płynnie łączy się ze współczesnym. Harmonia wizualnych, dźwiękowych i zapachowych bodźców, uzupełniona o doznania kulinarne, sprawia, że przestrzeń angażuje wszystkie zmysły, oferując doświadczenie jednocześnie intymne i wielowymiarowe. „Można tu poczuć duszę przestrzeni i obiektów oraz to, jak ze sobą rezonują”, pomyślałam, kiedy po raz pierwszy odwiedziłam Elisabeth w The Apt. Przy drugiej edycji projektu prezentującego globalną selekcję twórców niemiecka dyrektor kreatywna zaprosiła mnie nie tylko do poprowadzenia panelu dyskusyjnego w ramach The Apt Talks, lecz także do roli kuratorki polskiego akcentu. Wybrałam artystów zHasik Designi ich wyjątkowy obiekt: wazon Zefir z grubego, piaskowanego szkła na ręcznie szczotkowanym stelażu z aluminium, który naturalnie wpisał się w narrację The Apt02.
## Nowa era multidyscyplinarności: twórczość bez etykiet
Jednym z najbardziej fascynujących aspektów The Apt jest różnorodność perspektyw, jakie wnoszą zaproszeni artyści. Ich prace, choć osadzone w różnych technikach i materiałach, łączy wspólna wrażliwość.
## Energia, która zawsze jest w ruchu
Maria Fiter, polska projektantka ekologicznych lamp z papier mâché mieszkająca w Barcelonie, opisuje swoje dzieła jako „pełne sprzeczności”. Z jednej strony przypominają ciężkie, kamienne rzeźby, z drugiej – zachwycają swoją delikatnością i lekkością. Jej lampy powstają z papieru pochodzącego z recyklingu i odpadów, dzięki czemu zyskują nie tylko unikalną teksturę, lecz także głębsze znaczenie. Kluczowym elementem jej prac jest światło, które nadaje im głębię.– Światło ożywia formę – wprowadza ciepło, wydobywa subtelności i sprawia, że przestrzeń zyskuje nowy wymiar– wyjaśnia Maria. W jej rękach papier staje się nośnikiem emocji i intymności, balansując między rzeźbą a funkcjonalnym designem.","Kultura, Design","wnętrza, design, Barcelona, Gosia Boy"
https://www.vogue.pl/a/gwen-stefani-zaslynela-przebojem-don-t-speak-dlaczego-kariera-wokalistki-zwolnila-tempo,Gwen Stefani zasłynęła hitami o złamanym sercu. Dlaczego nie chcemy słuchać o jej szczęściu?,"Gwen Stefani z „Don’t Speak” uczyniła hymn pokolenia. Gdy śpiewała o złamanym sercu, publiczność ją kochała. Dlaczego jej gwiazda przygasła? Kariera wokalistki potwierdza, że im lepiej kobietom układa się w życiu, tym gorzej radzą sobie na listach przebojów.
## Gwen Stefani została oskarżona o przywłaszczenie kulturowe, gdy wykorzystywała elementy wizualne kultury japońskiej
Piosenkę, która na zawsze odmieniła jej życie, napisała, bo zostawił ją pierwszy poważny chłopak, kolega z zespołu. Ikoniczna ballada „Don’t Speak” z 1996 roku utrzymywała się na szczytach radiowych list przebojów przez kilka miesięcy. No Doubt, obecni wcześniej na scenie od dobrych kilku lat, grali kalifornijską wariację na temat żwawego ska. Po premierze trzeciej płyty – niesionej m.in. sukcesem „Don’t Speak” – awansowali do ekstraklasy pop rocka. Nikt w mainstreamie nie śpiewał o straconej miłości tak przejmująco jak Gwen Stefani. Gdy lata później rozpadło się jej małżeństwo z Gavinem Rossdale’em, muzykiem banalnie zdradzającym żonę z opiekunką do dzieci, napisała już nie jedną piosenkę, ale cały album. Pierwsza solowa płyta Stefani, „This Is What The Truth Feels Like” z 2016 roku, wylądowała na pierwszym miejscu notowania Hot 200 magazynu „Billboard”. –Tak, to rozwodowy album– mówiła na antenie jednej z amerykańskich rozgłośni radiowych. –Ale to też płyta, która pomogła mi uwierzyć w sens mojej drogi i Boga. To jest ten krzyż, który niosę. Musiałam doświadczyć rozpaczy z powodu złamanego serca, by napisać piosenki, które są wsparciem dla innych ludzi.Dziś żartuje w wywiadach, że wyczerpała już limit smutnych numerów i od tej pory zamierza śpiewać wyłącznie o spełnionej miłości, bo takiej doświadcza w małżeństwie z gwiazdą country, Blakiem Sheltonem. Pytanie tylko, czy publiczność chce słuchać szczęśliwej Gwen Stefani. Od lat nie odniosła wielkiego sukcesu.
## Piosenka „Just a Girl” to feministyczny hymn z przymrużeniem oka i zgrabna opowieść o dziewczyńskości
Stefani doskonale zdaje sobie sprawę z tego, jak działają preferencje słuchaczy. Możesz czujnie obserwować trendy i wymyślać siebie na nowo, a ludzie i tak wolą te piosenki, które już znają. Jak „What You Waiting For?”, którym Gwen Stefani rozpoczynała solową karierę, albo „Hella Good”, wielki przebój No Doubt napisany wspólnie zPharrellem Williamsem. –Artysta nagrywa nową płytę, bo dla niego nowy materiał jest ekscytujący. Ale ludzie chcą słuchać numerów, które towarzyszyły im w ważnych momentach życia. „Don’t Speak”, „Just A Girl”, „Hollaback Girl”– opowiadała trzy lata temu w rozmowie z magazynem „Paper”. W 2018 r. przyjęła ofertę rezydentury w Las Vegas, gdzie przez ponad rok, w zasadzie do wybuchu pandemii koronawirusa, grała koncerty z największymi przebojami. W tym samym wywiadzie dla „Paper” zauważała: –To prawdziwe błogosławieństwo, że jestem tak długo obecna na scenie i już nie muszę nikomu niczego udowadniać.
## Fani nie chcą słuchać o szczęśliwej Gwen Stefani. Dlaczego zachłystujemy się cierpieniem kobiet?
Ma rację, to kawałek pięknej kariery. Gdy No Doubt wydali swój trzeci album „Tragic Kingdom”, zainteresowanie zespołem było tak wielkie, że pozostawali w trasie koncertowej przez trzy lata. I to ona – charyzmatyczna platynowa blondynka z ustami wymalowanymi na czerwono, ubrana w ekscentryczne ciuchy wygrzebane w second handach – skupiała na sobie uwagę mediów. Kolegom z zespołu nie bardzo to odpowiadało, też chcieli okładek i komplementów, w sumie zasłużonych za efektowny eklektyzm, jaki uprawiali na płytach. Gwen Stefani rozpoczęła karierę solową jeszcze w trakcie działalności zespołu. Karierę niewolną od kontrowersji. Gdy wyznała, że „jest Japonką”, potwierdziła tylko, że krytyka bezrefleksyjnego zawłaszczenia kulturowego była w jej przypadku uzasadniona. Stefani swego czasu używała estetyki młodzieżowych japońskich subkultur, a na scenę i oficjalne gale chodziła w asyście tancerek z Tokio. Zarzucano jej, że z ignorancją typowej rasistki wzmacnia stereotypowe obrazy Azjatów i Azjatek. Stefani odbija argumenty, do tej pory podtrzymując, że jej współpraca z Harajuku Girls wynikała z absolutnej fascynacji japońską kulturą i modą, w której zakochała się, jeszcze będąc małą dziewczynką. Ojciec wokalistki pracował dla Yamahy, a z podróży służbowych do Tokio przywoził japońskie zabawki i opowieści o widowiskowo ubranych nastolatkach.","Ludzie, Portrety","Gwen Stefani, lata 90, muzyka, artystka, portret, Angelika Kucińska"
https://www.vogue.pl/a/debiut-marii-zbaskiej-to-nie-moj-film-mowi-o-kryzysie-w-milosci-jak-ocalic-zwiazek-ktory-sie-sypie,Czy 400 km wspólnego marszu może ocalić związek? „To nie mój film” to niebanalna produkcja o miłości,"Może w ich szaleństwie jest metoda. Gdy Wanda i Janek nie mogą się dogadać, ruszają w ekstremalną podróż. Zamierzają przejść 400 kilometrów brzegiem Bałtyku. Pieszo. Zimą. „To nie mój film”, pełnometrażowy debiut reżyserki Marii Zbąskiej, demontuje romantyczne mrzonki o związkach i pochyla się nad wagą kryzysu.
## Można pogapić się na morze, trzeba przyjrzeć się sobie
Ona miała śpiewać, on chciał przejechać świat rowerem. Ją dziś cieszą już tylko małe zwycięstwa w kuchni (publiczność docenia żart o kalafiorze), jemu sprawia radość chyba jeszcze mniej. Trwają w relacji, która rozpędzała się obiecująco, ale gdzieś po drodze wytraciła impet. Nie ma chemii, więc nie ma przyszłości? Wanda i Janek po kolejnej kłótni o nic i wymianie werbalnych ciosów poniżej pasa w stylu „weź coś ze sobą zrób” dokonują nie tylko rewizji porzuconych marzeń, ale też zmieniających się oczekiwań wobec siebie nawzajem. Robią rachunek zysków i strat, zachwytów i rozczarowań. Nie chcą się rozstać, nie chcą być razem. –Nie zakochamy się w sobie na nowo, siedząc na tej kanapie. Musimy się ruszyć– rzuca on i wpada na szaleńczy pomysł, by poddali swój związek ostatecznej próbie.
## Ciągnąć te sanki razem czy osobno?
Wanda i Janek, dwójkatypowych millenialsówz dużego miasta, kupuje sanki, pakuje namiot i rusza w podróż linią brzegową Bałtyku. Będą szli 400 kilometrów, gdy pada i wieje, nie korzystając z wygód cywilizacji. Umowa jest prosta. Jeśli dotrą do celu, nie łamiąc zasad, zostaną razem. Jeśli im się nie uda – rozstaną się. Pełnometrażowy debiut reżyserki i scenarzystki Marii Zbąskiej doceniono za mądre spojrzenie na uniwersalny temat. „To nie mój film” został nagrodzony m.in. na festiwalu filmowym w Gdyni czy na festiwalu Ekran, przeglądzie polskiego kina w Toronto. Czuła opowieść o relacji w kryzysie nie tylko ujmuje rozbrajającą lekkością i niewymuszonym humorem. „To nie mój film” skłania, by przyjrzeć się własnym przekonaniom na temat związków.
## Nie taki kryzys straszny
–Nikt nikomu nie mówi, że go kocha. Nikt się z nikim nie całuje. Jeśli jest seks, to taki, żeby nie wystawać za bardzo spod kołdry. Dlaczego? Bo w związkach z dziesięcioletnim stażem ludzie rzadko sobie mówią, że się kochają. Moi bohaterowie nie wiedzą, co do siebie czują. Zastanawiają się, czym w ogóle jest miłość– mówi mi Maria Zbąska, reżyserka i autorka scenariusza „To nie mój film”. Można się zżymać, że w swoim pierwszym długim metrażu opowiada historię, jakich wiele. Ale właśnie na tym polega największa siła tej produkcji. Każdy, kto był w dłuższej relacji, może przejrzeć się w doświadczeniach Wandy i Janka, zrozumieć ich frustrację i bezradność. Tylko kto wpada na pomysł, żeby ratować związek, wyjeżdżając zimą pod namiot?","Kultura, Kino i TV","maria zbąska, związki, Angelika Kucińska, to nie mój film"
https://www.vogue.pl/a/czy-przestalismy-flirtowac-i-uwodzic-w-czasach-aplikacji-randkowych,Czy sztuka flirtowania i uwodzenia w czasach aplikacji randkowych umarła?,"W 2024 roku ku naszemu niepocieszeniu ogłoszono, że sztuka flirtu jest na wymarciu. Za flirtowaniem tęsknią jednak nie tylko milenialki i milenialsi czy osoby ze starszych pokoleń, lecz takżegeneracja Z. Ta sama, która oskarżana jest o zabicie flirtu. Czy potrafimy jeszcze uwodzić i czy ta sztuka bywa przydatna we współczesnych czasach?
## Amelia Dimoldenberg pokazuje, jak flirtować
Catherine Hiller na łamach „Next Avenue” pisze, że pokolenie jej rodziców flirtowało w sklepach, w garażu i na imprezach. „Między mężczyznami i kobietami odbywały się pełne wdzięczności przekomarzania. To była jedna z małych przyjemności życia, znak, że ktoś uważa cię za atrakcyjnego. Nie chodziło o poderwanie kogoś lub zaciągnięcie go do łóżka”, opisuje dorastająca w latach 60. Hiller. Podobno jej 80-letnia, pełna uroku mama wciąż flirtuje. Ona sama próbuje również to robić w różnych sytuacjach życiowych, aby po prostu zobaczyć, co z tego wyniknie. Efekt? „Szczerze mówiąc, nie wiem, czy ludzie w ogóle to zauważają! Większość z nas nie jest już wyczulona na flirt, a ludzie nie oczekują tego od kobiety w moim wieku”, kwituje.
## Kto zabił flirt? Czy czasy uwodzenia są już za nami?
O flircie przypomniała nam wszystkim gwiazda YouTube’a,Amelia Dimoldenberg, którą „The New York Times” bez wahania określa mianem ekspertki od flirtu. Jest on nieodłącznym elementem serii „Chicken Shop Date” Amelii, którą prowadzi od ponad 10 lat. „Niezależnie od tego, kogo gości, czy to akurat Cher, czy Paul Mescal, Amelia Dimoldenberg potrafi zamienić swoje >>randki<< w restauracji typu fast food w wywiady napędzane chemią. Randki mogą być na niby, ale widzowie zawsze pozostają z wrażeniem, że gość celebryta prawdopodobnie byłby chętny na drugą” – podsumowuje jej flirciarski talent redakcja słynnego magazynu.
## Flirtowanie po#MeToo
Gdy oglądam „Chicken Shop Date”, przypomina mi się, że warto sprawdzić już na pierwszej randce, czy z daną osobą będziemy się dobrze bawić. Naturalnie wiele z nas nie chce tracić czasu i próbuje się przede wszystkim dowiedzieć, czy z potencjalnym partnerem czy partnerką jesteśmy w miarę zgodni – pytamy więc o pracę, politykę, chęć posiadania dzieci. To ważne, więc jak najbardziej warto o to zapytać, gdy myślimy o poważnej relacji i nie chcemy tracić czasu. Ale nie musi to wyglądać jak wywiad czy przesłuchanie. Nawet dość trudne pytania można obrócić we flirt. Bo chemia jest ważna. Bo poczucie humoru jest ważne. Często sprawiają, że nawet niedopasowane z pozoru osoby tworzą udane związki, a różnice, które wydawały się nie do przeskoczenia, okazują się nie być przeszkodą. Poza tym, co nam po perfekcyjnym dopasowaniu pod względem wartości i spojrzenia na przyszłość, jeśli zabraknie iskry, napięcia, przyciągania?
## Jak więc flirtować w świecieaplikacji randkowych?
Dlaczego jednak flirtowanie wielu osobom przychodzi z trudem? Skąd ten cały dyskurs o śmierci flirtu, uwodzenia, romansu jak sprzed lat? Może tęsknotę za tym budząprodukcje kostiumowe z „Bridgertonami” na czele, które idealizują sztukę uwodzenia, zalotów i flirtu. Czy rzeczywiście wszystkiemu winne są aplikacje randkowe, pandemia oraz praca i nauka z domu, które pogorszyły nasze umiejętności interpersonalne lub nie pozwoliły im się wykształcić, w połączeniu zkapitalistycznym, „transakcyjnym"" podejściem do miłości?","Styl życia, Społeczeństwo","randkowanie, Aplikacje randkowe, generacja Z"
https://www.vogue.pl/a/kim-jest-amelia-dimoldenberg-youtuberka-ktora-zaprasza-gwiazdy-na-randki-nad-kurczakiem,Fenomen wiralowych randek Amelii Dimoldenberg,"Z Billie Eilish wyciągnęła przebojową flirciarę, Paul Mescal wydawał się autentycznie speszony, a chemią między nią a Andrew Garfieldem ekscytuje się cały internet. „Chicken Shop Date” Amelii Dimoldenberg w tym roku obchodzi dziesięciolecie istnienia.
## Jak sekstinguje Ed Sheeran i co sądzi o seksie z młodszym mężczyzną Cher?
–Sama w życiu bym nie poszła do „Chicken Shop Date”– rzuciła nagle w wywiadzie, który rok temu przeprowadziła z nią dziennikarka „The Guardian”. –A co, jeśli ludzie pomyślą, że nie potrafisz flirtować?Kilka słów wprowadzenia dla tych, którym idea randki nad porcją nuggetsów jest wciąż obca: Amelia Dimoldenberg zaprasza gwiazdy do barów serwujących panierowane kawałki kurczaka (popularny koncept w Wielkiej Brytanii), ale nie prowadzi klasycznego wywiadu, bo wszystko tu rozgrywa się w konwencji pierwszego spotkania potencjalnych kochanków. Z zazwyczaj czterdziestominutowej rozmowy powstaje kilkuminutowy odcinek pełen niezdarnych prób uwodzenia. „Chicken Shop Date” to test dla każdej gwiazdy, która zdecyduje się przyjąć zaproszenie. Czy zrozumie specyfikę programu? Czy ma wystarczająco dużo luzu, dystansu do siebie i poczucia humoru, by dźwignąć cięte przytyki i absurdalne pytania prowadzącej? Coraz większe nazwiska, które zaczęły pojawiać się w „Chicken Shop Date”, na pewno wpływają na wzrost zainteresowania programem youtuberki, ale największą siłą pozostaje tu sama Dimoldenberg, urodzona komiczka o pokerowym wyrazie twarzy, która kocha wyprowadzać swoich gości w pole. Raz wchodzi w rolę głodnej komplementów atencjuszki, by za chwilę ekspresowo przepoczwarzyć się w złośliwy sopel lodu. Podrywa, ale nie przekracza granic, nie jest napastliwa, a jej program można czytać jak satyrę dominującego wyobrażenia o romantycznej randce. Szydzi, ale nie jest okrutna. Jest za to szybka, błyskotliwa i cudownie niedorzeczna.
## Sarkazm, który miał być bronią przed zawodem, stał się znakiem rozpoznawczym Amelii Dimoldenberg
Raper Jack Harlow musiał się zmierzyć z bezczelnym pytaniem o to, czy umie czytać. Billie Eilish dostała zagadkę natury filozoficznej: „Gdybyś była lodem w wafelku, to walałabyś, żeby cię lizali czy może żeby gryźli?”. Gdy Ed Sheeran wyznał, że nie ma telefonu, chciała wiedzieć, jak w takim razie wysyła sprośne SMS-y. –To jak sekstingujesz?– dociekała. –Osobiście– odparował skrępowany muzyk. Od Cher chciała się dowiedzieć, czego każda kobieta powinna spróbować przynajmniej raz w życiu. –Młodszego mężczyzny– odpowiedziała piosenkarka. Niektórzy radzą sobie z oryginalną koncepcją Dimoldenberg naprawdę świetnie. Paul Mescal ujmuje naturalnością, peszy się, ale i odbija piłeczkę. Odcinek z Andrew Garfieldem, do tej pory najdłuższy w serii, który opublikowała w połowie października, w ciągu tygodnia obejrzano ponad 7,5 mln razy. „Głowa mi mówi, że grają. Serce podpowiada, że się kochają” – napisał ktoś w komentarzu. „Zapłacę, żeby zobaczyć pełne nagranie z tego spotkania” – oferował ktoś inny. „To wideo jest albo absolutnym popisem aktorskiego mistrzostwa, albo publiczną deklaracją miłości. Nie ma innej opcji” – wyrokował kolejny komentujący.
## Amelia Dimoldenberg mimo uprzywilejowanej pozycji głośno mówi o nierówności w mediach

## Amelia Dimoldenberg udowadnia, że singielka może być specjalistką od randek
W podcaście „At Your Service”, który stworzyła i prowadzi Dua Lipa, Amelia Dimoldenberg objaśniała różnicę pomiędzy randkami, na które zaprasza mężczyzn, a tymi, podczas których je kurczaka z kobietami. –Z chłopakami sobie zawsze poradzę. Mam swoje sposoby. Ale kobiety nie przechytrzysz. Dziewczyny znają wszystkie sztuczki, są bystre, dlatego odcinki z nimi stresują mnie dużo bardziej– mówiła. Dua Lipa pytała też Amelię Dimoldenberg o jej sarkastyczne poczucie humoru. Cierpki, ostry, inteligentny dowcip to w końcu znak rozpoznawczy youtuberki. –Gdy jesteś nastoletnią dziewczyną, kontakty z chłopakami bywają traumatyczne. Chłopcy cię oceniają, potrafią okrutnie komentować twój wygląd. Mnie mówili, że mam za duże uszy albo nieładne czoło, więc nie powinnam wysoko upinać włosów. Tamte uwagi wciąż żyją w mojej podświadomości– opowiadała Dimoldenberg. –Dlatego długo moim nadrzędnym celem było podobanie się mężczyznom. Do dziś mierzę z się tym przekonaniem, że muszę się postarać, wypaść atrakcyjnie w oczach faceta, przypodobać mu się. Sarkazm pozwala mi się obronić. I nawet jeśli niektórych to zniechęca albo dezorientuje, to i tak będę go używać. To moja supermoc– tłumaczyła komiczka.","Ludzie, Portrety","Amelia Dimoldenberg, wiral, moda, Angelika Kucińska"
