url,heading,content,category,tags
https://www.vogue.pl/a/aktorka-maggie-smith-niezapomniana-minerwa-mcgonagall-z-harry-ego-pottera-zachwycala-na-ekranie-i-w-zyciu,Maggie Smith zachwycała klasą wielkiej damy kina na ekranie i w życiu,"Trudno uwierzyć, że minęło zaledwie 15 miesięcy, odkąd świat ujrzała ekskluzywna kampaniaLoewe z 88-letnią Maggie Smithw roli głównej. Na jednej z fotografii autorstwaJuergena Telleraubrana w sztuczne futro aktorka ściska reprezentacyjną dla markiPuzzle Bagi uśmiecha się przyjaźnie. Błysk w oku, który pojawia się, gdy patrzy z ironią w obiektyw, przywodzi na myśl wyniosłość i przekorę arystokratek, w które przez całe życie się wcielała.
## Brytyjski skarb narodowy
Kto mógł przewidzieć, że będzie to ostatni z jej publicznych portretów. Tym bardziej symboliczny, bo korespondujący ze zdjęciami, na których utrwalono ją w ciągu trwającej ponad siedem dekad kariery.Jedną z nich wykonał w 1969 roku Adam Smith: ubrana w ciepłe futro Maggie stoi przy alei w Hollywood i uśmiecha się szeroko. To ważny w jej życiu moment, gdy kariera za oceanem nabiera rozmachu po występie w „Pełni życia panny Brodie”, za który zdobyła pierwszego Oscara. Te dwa zdjęcia Brytyjki po latach zdają się dopełniać. I choć z wiekiem jej uśmiech nabrał ironicznej głębi, to widoczna już na pierwszym portrecie pewność siebie zwiastowała rozwój jednego z największych – i wyjątkowo nieoczywistych – brytyjskich talentów XX wieku.
## Szyderczyni o dydaktycznym zacięciu i gołębim sercu
Dame Margaret Natalie Smith, ikonę teatru i kina ze Zjednoczonego Królestwa, zdobywczyni sześciu nominacji do Oscara, trzech Złotych Globów i czterech nagród Emmy,pożegnaliśmy z końcem września tego roku. Przez kilka tygodni fani z całego świata wspominali jej uprzejmą stanowczość w roli Minerwy McGonagall zserii o „Harrym Potterze”, błyskotliwe riposty, którymi puentowała każdą konwersację jako hrabina Violet z„Downton Abbey”, czy surowość pani Medlock z „Tajemniczego ogrodu”. Prywatna uroczystość pogrzebowa dla najbliższych odbyła się 4 listopada w londyńskim Richmond, a kondolencje przysłałkról Karol, premier Keir Starmer i wielu współpracowników. Choć aktorka miała 89 lat, wiadomość o jej śmierci zaskoczyła opinię publiczną, trafiając w najczulszy punkt serc fanów, nieprzygotowanych na podobną wiadomość. W końcu milenialsi, ale i wielu młodszych (oraz, jak sądzę, także starszych) entuzjastów talentu Smith poznało ją głównie za sprawą kinowych ról stworzonych w dojrzałym wieku. W irracjonalny sposób sprawiała wrażenie osobowości niezniszczalnej, której prawa obowiązujące normalnych śmiertelników zdawały się nie dotyczyć.
## Najważniejsza jest scena
Być może kluczowe dla fenomenuMaggie Smithokazało się to, co dostrzegł już lata temu aktor John Gielgud: fakt, że była niepodobna do nikogo innego, dlatego oglądając ją na scenie lub ekranie, trudno kiedykolwiek mieć jej dość.
## Macierzyństwo na własnych zasadach
Wygląd to jedna z tych cech, które od początku stawiały ją w osobnej kategorii. Jako wysoka i szczupła aktorka o konfudujących oczach nie wpisywała się w standardowe kanony piękna, co nie przeszkodziło jej już w nastoletnim wieku zawładnąć deskami angielskich teatrów, a potem okazało się siłą w filmach kostiumowych (jak „Plac Waszyngtona”Agnieszki Hollandczy„Gosford Park”Roberta Altmana). Razem ze swoją ekranową koleżankąJudi Dench, wbrew powszechnemu w Hollywoodageizmowi, w naturalny sposób kwestionowała stereotypy wiekowe, a linia jej popularności wraz z upływem czasu raczej wznosiła się, niż opadała. Wpisaną w jej rysy wyniosłość, którą dodatkowo wyostrzyły przebyte choroby (chorowała na raka piersi i autoimmunologiczną chorobę Gravesa-Basedowa), oswoiła kamera: w końcu już w trakcie zdjęć do „Hooka” w 1991 roku jeden z pracowników działu kostiumów na pytanie Spielberga o to, ile aktorka ma lat, bez wahania odrzekł: –92!
## Scena jako konieczność
Wwiralowym filmiku na TikTokuSmith śmiała się, że Judi Dench zgarnia wszystkie dobre role dla starszych kobiet, więc dla reszty już niewiele zostaje. Ale to nie do końca prawda: choć ostatnie dekady życia zostały zdefiniowane przez wizyty w Hogwarcie i posiadłościach lorda Granthama, to równie ciekawe postaci udało jej się stworzyć w „Lawendowym wzgórzu” (2004),„Hotelu Marigold”(2011) czy w „Damie w vanie” (2015). Do późnej sławy podchodziła jednak z wyraźnym sceptycyzmem i bez sentymentów. –Wszystko jest ikoniczne– oświadczyła na wręczeniu nagrody „Evening Standard” dla ikon teatralnych. –Jeśli jesteś na scenie wystarczająco długo, stajesz się ikoną, i to raczej zakurzoną. Albo skarbem narodowym.Twierdziła, że sława jest ulotna, a ludzie szybko zapominają przeszłe legendy. –Myślę, że to musi być piekło– skomentowała ideę bycia celebrytą. Z tego powodu nigdy nie marzyła o napisaniu autobiografii i nie prowadziła pamiętników. Do końca pozostawała otwarta na zawodowe wyzwania: jak choćby w 2019 roku, gdy po 12 latach przerwy od występów w teatrze, wykonała stuminutowy monolog w spektaklu „A German Life” w londyńskim teatrze Bridge, stanowiący wariację na temat losów sekretarki Josepha Goebbelsa. –Potrafi być jednocześnie wrażliwa, zacięta, ponura i zabawna, a każdego dnia wnosi na plan energię i ciekawość młodego aktora, który dopiero zaczyna –miał podsumować to aktywne nastawienie Nicholas Hytner, reżyser „Damy w vanie”. Te cechy pasowały do niej do samego końca.","Ludzie, Portrety","Maggie Smith, Harry Potter, Downton Abbey, filmy, sylwetka, Joanna Najbor"
https://www.vogue.pl/a/digitalsyndication-jak-wygladaja-wiralowe-buty-2025-roku-to-sneakersy-na-obcasie-balenciagi,Wiralowe buty Balenciagi to połączenie sneakersów i… szpilek,"Buty, w których zaledwie jeden krok dzieliporanny trening biegowyod wieczornej imprezy? To kolejny kontrowersyjny projekt Balenciagi z potencjałem na tiktokowy wiral. Czy podzieli entuzjastów mody, tak jak zrobił toprojekt Tabi Maison Margiela?
## Balenciaga przedstawia swoje noweit-shoesnajesień-zimę 2024-2025
Już pierwszą kolekcją dlaBalenciagiw 2015 roku, dzięki swojej niezwykłej kreatywności i pragmatycznej wizji luksusu, Demna uwiódł cały świat mody. Dziewięć lat później projektant określany mianem undergroundowego nadal zaskakuje, na nowo tworząc nowoczesną garderobę za pomocą swojego wywrotowego podejścia do mody.","Moda, Zjawisko","moda, buty, sneakersy, Balenciaga, Alexandre Marain"
https://www.vogue.pl/a/tina-barney-fotografuje-mode-i-gwiazdy-ale-sercem-jej-zdjec-sa-emocje,Dla Tiny Barney moda wyraża emocje. Zdjęcia fotografki oglądamy na wystawie w Paryżu,"Emily Ratajkowskiwcieliła się w rolę miss świata w najnowszej kampaniimarki Self-Portrait. Za obiektywem stanęła amerykańska fotografka Tina Barney, której pierwszą europejską retrospektywę, dokumentującą w 55 zdjęciach ponad 40 lat pracy artystycznej, można oglądać w paryskim Jeu de Paume. Mimo że Barney od lat fotografuje gwiazdy i tworzy kampanie, to jednak nie moda jest sercem tej wystawy. Artystka odkrywa przed nami swoje twórcze korzenie, w których ubranie jest symbolem czegoś trwalszego niż sezonowy trend.
## Od fotografowania najbliższych do fotografii inscenizowanej
Wystawę „Family Ties” w Jeu de Paume otwierają fotografie pochodzące z „Theater of Manners”,pierwszej monograficznej (i jednej z dwóch najważniejszych) publikacji Tiny Barney z 1997 roku. Przeglądając ten album w muzealnej księgarni, jeszcze przed wejściem na ekspozycję, zwracam uwagę na zdjęcie „The Ocean House” z 1977 roku, przedstawiające przestrzenną werandę amerykańskiego domu. Jedyne, które udało mi się dotychczas znaleźć, pozbawione w kadrze ludzi. To właśnie w ich stronę od lat 70. XX wieku Barney kieruje swój aparat. Na początku byli to najbliżsi: mama, siostra, przyjaciele, później też synowie (Barney fotografuje ich do dziś, twierdząc, że dokumentowanie tej relacji na przestrzeni dekad to sposób na wyrażanie głębokiej miłości).
## Tina Barney pokazuje, jak żyją europejskie wyższe sfery
Pierwszą scenerią było rodzinne Rhode Island, gdzie artystka samouk po prostu podpatrywała przypadkowe sytuacje i znajomych ludzi. Z czasem zauważyła, że coraz częściej skupia się na tych samych tematach: gestach, elementach ubioru, wzajemnych interakcjach, wnętrzach domów. Wtedy poczuła, że nie chce zdawać się w pełni na przypadek. Pierwsze wyreżyserowane zdjęcie – „Amy, Phil and Brian” – zrobiła w 1980 roku. Rozstawiła trzech członków swojej rodziny na przeciwległych krawędziach domowego basenu, żeby podkreślić narastający dystans, który jej zdaniem dominował ówcześnie w relacjach międzyludzkich. Na początku lat 80. ingerencja w kadr nie była powszechną praktyką – na fali popularności byli fotografowie tacy jak Garry Winogrand, którego zdjęcia miały silny pierwiastek naturalności i przypadkowości. Barney jednak konsekwentnie kształtowała swój artystyczny język. Zainspirowana renesansowym włoskim malarstwem i malarstwem holenderskim XVII wieku, do dziś tworzy kompozycje gęste od szczegółów scenografii i mikronapięć między postaciami. Mam wrażenie, że potrafi zamienić jedno zdjęcie w cały odcinek serialu, w którym każdy świadomie wyeksponowany element zdaje się mówić coś o relacjach i historii bohaterów.
## Specyfika miejsc i uniwersalność relacji międzyludzkich
Estetyka Barney dość szybko znalazła uznanie. Jej prace zostały pokazane na wystawie „Big Picture” w nowojorskim MoMA w 1983 roku – to jedna z najważniejszych prezentacji fotografii wielkoformatowej w tamtym czasie, ukazująca nowe podejścia do kompozycji oraz techniki. Ekspozycja skupiła się na dziełach fotografów, którzy korzystali z dużych formatów i wysokiej rozdzielczości, aby uchwycić intymność i złożoność codzienności. Wspomniane już postaci ludzkie, duży format, fokus na detale, które – jak mówi artystka – budują kompozycję zdjęcia tak, aby oko, krążąc po jego najmniejszych szczegółach, jeszcze bardziej się w nie zagłębiało, to integralne części fotograficznego języka Barney.","Kultura, Sztuka","Marzena Jarczak, Tina Barney, sztuka, fotografia, wystawa"
https://www.vogue.pl/a/polski-film-ludzie-i-rzeczy-z-szansa-na-nagrode-na-prestizowym-festiwalu-sundance-2025,Przejmujący polski film „Ludzie i rzeczy” ma szansę na nagrodę na festiwalu Sundance 2025,"„Ludzie i rzeczy” Damiana Kosowskiego to jedyna produkcja z Polski, która znalazła się w Międzynarodowym Konkursie Filmów Krótkometrażowych Festiwalu Sundance 2025 – najważniejszej imprezie na świecie poświęconej niezależnemu kinu. Rozpisana na czwórkę aktorów nowela jest precyzyjna i trafia prosto w serce.
## Film „Ludzie i rzeczy” uzmysławia, że spowodowane wojną cierpienie nie ustaje wraz z końcem konfliktu zbrojnego
Akcja filmu Damiana Kosowskiego rozgrywa się w 2028 roku w Ukrainie, która wygrała wojnę z Rosją. 34-letnią Olenę (Oksana Cherkashyna) poznajemy w chwili, gdy przyjeżdża do zrujnowanego ośrodka kultury i sportu gdzieś na wschodzie kraju, aby zakończyć formalności związane z odnalezieniem szczątków męża. Badania wskazują na zgodność danych DNA z ich ośmioletnią córką Kirą (Kira Makidon), która towarzyszy matce. Jest z nimi również Tymur (Stanislav Voitsekhovskyi), obecny partner Oleny. Pracami ekshumacyjnymi kieruje pochodząca z Polski antropolożka, doktorka Ewa (Grażyna Misiorowska). Tylko czy na pewno wszystko się zgadza i czy ta podróż jest zamknięciem iprzepracowaniem wojennych traum, czy tylko nowym emocjonalnym paliwem dla nich? Wiadomość o odnalezieniu szczątków męża zmusza Olenę do dokonania wyboru między teraźniejszością a światem, który przeminął. Jej decyzja wydaje się jedyna słuszna, ale czy również dla każdego z nas, widzów, dla każdej z ofiar? Kosowski nie daje jednoznacznej odpowiedzi, ale daje pocieszenie i nadzieję.
## Film „Ludzie i rzeczy” Damiana Kosowskiego bierze udział w konkursie festiwalu Sundance 2025
Krótki metraż wymaga dyscypliny oraz syntezy i taki jest film Kosowskiego. Nie ma w nim miejsca na eksperymenty formalne, nie ma też miejsca na zbędne słowa, a te, które padają w filmie, mają swoją moc i znaczenie. Ta rozpisana na czwórkę aktorów nowela jest precyzyjna i trafia prosto w serce, a to, co dzieje się między słowami, okrucieństwa wojny, pokazane jest z szacunkiem dla ich ofiar.– Lubię takie krótkie filmy, które są niczym haiku, wiersze. Nie przepadam za shortami udającymi pełne metraże– mówi reżyser Damian Kosowski i jest w tym konsekwentny. Zrealizował ponad 10 filmów krótkometrażowych. Jego studencka etiuda „Zanim zasnę” była prezentowana na ponad 30 festiwalach na całym świecie. Za dyplomowy „Stwór” otrzymał Srebrną Kijankę (przyznawany studentom odpowiednik Złotej Żaby) na festiwalu Camerimage 2022.","Kultura, Kino i TV","filmy, Damian Kosowski, Sundance Film Festival, Artur Burchacki"
https://www.vogue.pl/a/podcast-ikony-stylu-lat-90-s-1-odc-6-sarah-jessica-parker-nie-jestem-carrie,"Podcast „Ikony stylu lat 90.”, s. 1, odc. 6: Sarah Jessica Parker. „Nie jestem Carrie”","Gdy w1998 roku„Seks w wielkim mieście”debiutował w telewizji,Sarah Jessica Parkermiała 33 lata i była pełna obaw. Czy główna rola w serialu o seksie to dobry pomysł i czy nie zaszkodzi jej karierze.Mąż Parker, aktor Matthew Broderick, był jednak przekonany, że powinna ją przyjąć. Pobrali się raptem rok wcześniej.Sarah na swoim ślubie wystąpiła nie w białej bezie, ale w „małej czarnej”.Już wtedy miała świetny gust, ale wraz premierą„Seksu w wielkim mieście”stała się absolutną ikoną stylu. Od latpodkreśla jednak, że z serialową Carrie Bradshaw ma niewiele wspólnego. Tymczasem ostatnio ponownie się w nią wciela, choć zewsząd słyszy, że jest na tę rolę za stara. Jak radzi sobie zageizmemi dlaczego nie lubi być porównywana ze swoją bohaterką?
","Moda, Zjawisko","Podcast „Ikony stylu lat 90.”, podcasty, Natalia Hołownia, Sarah Jessica Parker, Seks w wielkim mieście, ikony stylu, Lata 90., stylizacje gwiazd, I tak po prostu, and just like that"
https://www.vogue.pl/a/po-te-ubrania-paryzanki-siegaja-by-wygladac-szykownie-zima-i-wiosna-2025-jak-stworzyc-modny-look-w-paryskim-stylu,"5 basiców, po które paryżanki sięgają, by wyglądać stylowo niezależnie od okazji","Od paryżanek stylu uczymy się o każdej porze roku. Zwłaszcza wtedy, gdy nie wiemy, w co się ubrać, a chcemy wyglądać tak stylowo, jak one.Odpowiedź na pytanie „jak one to robią?” jest prosta– sięgają po wysokiej jakości basicowe ubrania i dodatki, które stylizują na różne sposoby i noszą na każdą okazję. To dzięki nim zawsze wyglądają szykownie.Na jakie ubrania w stylu paryżanek warto postawić zimą 2025 roku i jak je nosić?
## Dobrze skrojone jeansy to podstawa szafy paryżanek.Najlepiej, by kończyły się przed kostką i były vintage
Niezawodne, doskonale skrojone i wysokiej jakości ponadczasowe elementy garderoby są nie tylko przepisem paryżanek na to, jak zawsze wyglądać szykownie,ale niezbędnikami francuskiego stylu w nurcie „je ne sais quoi”.Mieszkanki francuskiej stolicy inspirują nim od lat, a kobiety na całym świecie próbują je naśladować.
## Ulubiony trencz zimą 2025 roku paryżanki zmieniają na elegancki wełniany płaszcz w czarnym kolorze.Jest kwintesencją wygody i szyku
Zimą 2025 roku także sięgają po ulubione basicowe elementy zimowej garderoby,nosząc je w różnych stylizacjach oraz miksując z największymi trendami sezonu.Oto najważniejsze z nich, idealne do zbudowania minimalistycznej szafy kapsułowej w paryskim stylu.
## Dla Francuzek nie ma szykownej eleganckiej stylizacji bez białej koszuli– koniecznie oversize’owej i w męskim stylu
Choć paryżanki chętnie eksperymentują z modnymi fasonami jeansów (noszą modele skinny,bootcutibaggy),zawsze powracają do ulubionego fasonu, czyli klasycznych jeansów z prostą nogawką kończącą się nad kostką.Wiedzą, że ta długość w połączeniu z botkami na obcasie, czółenkami,a nawet balerinkami,pięknie wydłuża sylwetkę i balansuje jej proporcje. Jeansy paryżanki noszą od rana do wieczora – do pracy ze swetrem i marynarką, a na kolację z wyjściowym topem.
## Z dopasowanej marynarki paryżanki są w stanie wyczarować nawet kilkanaście modnych stylizacji zimowych.Zimą 2025 roku zamiast ze spodniami, noszą ją ze spódnicą
Klasyczne płaszcze z wełny o doskonale skrojonym fasonie mieszkanki francuskiej stolicy lubią tak, jak trencze,które noszą wczesną wiosną i późną jesienią.Wełniany płaszcz do połowy łydki lub przed kostkę, w ponadczasowym czarnym kolorze, jest bazą ich codziennych szykownych stylizacji. Zimą 2025 roku łączą go z jeansami albo spodniami ze skóry i luksusową torebką, która dodaje temu duetowi elegancji i wyrafinowania.
## Prosty biały T-shirt paryżanki noszą przez cały rok.Zimą 2025 roku łączą goz modnym kardiganem z wełny merinolub płaszczem
Nonszalanckie paryżanki nieustannie zachęcają nas do poszukiwania inspiracji w męskiej szafie.Ulubioną białą koszulę – o oversize’owym i inspirowanym męskim stylem fasonie –często traktują jak sukienkę, łącząc z obszerną marynarką lub płaszczem i czarnymi rajstopami. To prosty przepis, by przy pomocy uniwersalnych basików stworzyć zupełnie nowy look – modowy recykling jest bardzo w modzie, nie tylko w Paryżu.","Moda, Street Style","paryski styl, zima 2025"
https://www.vogue.pl/a/podcast-slowo-za-slowo-s-4-odc-6-artur-domoslawski-o-ameryce-lacinskiej,"Podcast „Słowo za słowo”, s. 4, odc. 6: Artur Domosławski o Ameryce Łacińskiej","Z reporterem Arturem Domosławskim rozmawiam o jego najnowszym reportażu „Rewolucja nie ma końca. Podróże w krainie buntu i nadziei” (Wydawnictwo Literackie), jednej znajważniejszych książek, które ukazały się w mijającym roku. Pytam o nadzieję i jej znaczenie w kontekście zmian zachodzących w Ameryce Łacińskiej w ciągu ostatnich dekad, o maczystowskich przywódców i o wybitne przywódczynie, o siłę i determinację tamtejszych kobiet.
","Kultura, Książki","podcasty, Podcast „Słowo za słowo”, Maria Fredro-Smoleńska, książka, książki, literatura faktu, reportaż"
https://www.vogue.pl/a/mariaz-pielegnacji-i-makijazu-w-linii-les-essentiels-du-maquillage-eisenberg-paris,No Heading,"
","Premiery, Zjawisko, Historia, Pielęgnacja, Zdrowie, Zdrowie, Design, Sztuka, Kino i TV, Portrety, Portrety, Portrety, Kulinaria, Społeczeństwo, Miejsca, Makijaż i włosy","Eisenberg, Eisenberg Paris, makijaż, Maria Kowalczyk/Nostressbeauty"
https://www.vogue.pl/a/jakie-buty-nosic-zamiast-kozakow-trapery-damskie-na-zime-2025-roku-to-hit-wedlug-rihanny-i-jennifer-lopez,Zimą 2025 roku trapery to alternatywa dla kozaków. Pasują do eleganckich stylizacji,"Wzorem Rihanny iJennifer Lopez,zimą 2025 rokueleganckie kozakizamieniamy nadamskie traperyw motocyklowym lub roboczym stylu. Workery i bikery na traperze doskonale uzupełniają casualowe i szykowne stylizacje. Podpowiadamy, z czym najlepiej nosić wygodne i ciepłetrapery damskiezimą 2025 roku.
## Najmodniejsze buty zimowe? Mocne trapery na zimę 2025 roku detronizują klasyczne kozaki
Rihannai JLo nie mogą się mylić. Zimą 2025 roku stawiają naciepłe i wygodne buty na traperze. Wiązane workery i bikery okazują się na tyle uniwersalnymibutami zimowymi, że możemy je nosić do puchówek, płaszczy i futer. Sprawdzą się i w biurze, i na randce. Co więcej, wiosną 2025 roku doskonale przełamią romantyczny styl lekkich sukienek lub zwiewnych spódnic, dodając im awangardowego sznytu. W jakie trapery damskie na zimę 2025 roku warto zatem zainwestować?","Moda, Zjawisko","trapery, buty zimowe, zima 2025, Jennifer Lopez, Rihanna"
https://www.vogue.pl/a/podcast-meskie-swiaty-s-5-odc-4-marszand-gosc-wojciech-grzybala,"Podcast „Męskie światy”, s. 5, odc. 4: Marszand. Gość: Wojciech Grzybała","W najnowszym odcinkupodcastu „Męskie światy”rozmawiam z Wojciechem Grzybałą, historykiem sztuki, marszandem i popularyzatorem twórczościAndrzeja Wróblewskiego. Jak męskość przedstawiana jest sztuce? Czy „męskość” jest tematem na kolekcję? W tej fascynującej rozmowie zgłębiamy rolę mężczyzn w sztuce oraz analizujemy, jak twórczość Wróblewskiego ukazujemęskośćw powojennej Polsce. Zapraszam do wysłuchania tego odcinka pełnego wnikliwych refleksji i odkryć na temat pozycji mężczyzn w świecie sztuki.
","Ludzie, Opinie","Podcast „Męskie światy”, Robert Kowalczyk, podcasty, Andrzej Wróblewski, męskość, sztuka"
https://www.vogue.pl/a/film-rozwazna-i-romantyczna-na-podstawie-powiesci-jane-austen-to-melodramat-ktory-wciaz-wzrusza,„Rozważną i romantyczną” 30 lat po premierze ogląda się jak film o współczesnych randkach,"Elinor (Emma Thompson) to ta rozważna, a jej młodsza siostra Marianne (Kate Winslet) – romantyczna. Czy aby na pewno? Ekranizacja powieści Jane Austen „Rozważna i romantyczna” w reżyserii Anga Lee trafiła na ekrany kin w 1995 roku. W 2025 roku klasyczny melodramat pomaga zrozumieć zasady rządzące współczesnymi randkami.
## Bohaterki „Rozważnej i romantycznej” buntują się przeciwko światu, w którym od miłości ważniejszy jest status
U mnie zaczęło się od „Mansfield Park”. Okładkę utrzymaną w zielonej tonacji zdobiła reprodukcja obrazu wiejskiej posiadłości. W 1995 roku w Katowicach o takich pałacach nawet mi się śniło. Miałam 11 lat i po raz pierwszy zanurzyłam się w powieść Jane Austen. Intrygi miłosne angielskiej wyższej (i najwyższej) klasy śledziłam z wypiekami na twarzy. Niewiele rozumiałam ze społecznego tła, który jedna z najważniejszych pisarek w historii literatury kreśliła ze swadą, ale przemawiały do mnie emocje, humor, język. Przeżywając już pierwsze nieśmiałe zakochania, mogłam utożsamić się z pannami na wydaniu (często niewiele starszymi ode mnie, wchodzącej w okres nastoletni czytelniczki) wzdychającymi do przystojnych arystokratów, lordów, posiadaczy ziemskich. Bawiły mnie bon moty, pewna nieporadność bohaterów, nieporozumienia nieznośnie wydłużające oczekiwanie na happy end (o ile wcześniej zakochani mogliby się zejść, gdyby nie wszystkie te fałszywe informacje, kłamliwe liściki, niedyskretne półsłówka). Echa charakterystycznego dla Austen dowcipu odnalazłam potem w komediach romantycznych, takich jak„Cztery wesela i pogrzeb”,„Notting Hill”czy„To właśnie miłość”. Fabułą te współczesne klasyki nie różnią się zresztą specjalnie od Austenowskiego kanonu.
## „Rozważna i romantyczna” w reżyserii Anga Lee opowiada zarówno o miłości, jak i o nierównościach
Po „Mansfield Park” o biednej Fanny Price, której bez posagu trudniej znaleźć męża, ale i tak zdobywa miłość, sięgnęłam po „Emmę” (zekranizowaną kilka razy, ostatnio przez Autumn de Wilde z Anyą Taylor-Joy w tytułowej roli), „Dumę i uprzedzenie” i, oczywiście, „Rozważną i romantyczną”. Tytuł powieści z 1811 roku odnosił się do dwóch sióstr – starszej Elinor kierującej się zdrowym rozsądkiem i młodszej Marianne ulegającej porywom serca. W toku akcji zubożałe panny Dashwood zamieniają się rolami – Elinor przekonuje się o sile swojej miłości do Edwarda Ferrarsa, a Marianne rozczarowana niestałością uczuć Johna Willoughby’ego decyduje się na dojrzały, oparty na zaufaniu, poważny związek z wiernym pułkownikiem Brandonem.
## Gwiazdorska obsada filmu „Rozważna i romantyczna” świetnie oddaje ponadczasowość historii napisanej przez Jane Austen
Obie do małżeństwa łagodnie skłania owdowiała matka. Jako że zgodnie z ówczesnym angielskim prawem dziedziczyły tylko dzieci z pierwszego małżeństwa, majątek pana Dashwooda (Tom Wilkinson) przypadł w całości jego pierworodnemu synowi. Trzy córki – najmłodsza siostra Elinor i Marianne, Margaret, to jeszcze dziecko – zostają zmuszone do przeprowadzki do mniejszego domu, pozbawione środków utrzymania, wydane na pastwę mniej lub bardziej uczciwych adoratorów. Na początku XIX wieku godne życie kobiecie zapewnić mógł tylko mąż. I Elinor, i Marianne o tym wiedzą, ale obie na swój sposób się przeciwko temu ograniczeniu buntują. Elinor wchodzi w rolę surowej zarządczyni uszczuplonego majątku. Ważniejsza od zamążpójścia wydaje jej się opieka nad matką i siostrami. Marianne ucieka w świat marzeń, gdzie o zamążpójściu decyduje miłość, a nie status. Obie buntowniczki ostatecznie wpiszą się w społeczne ramy, ale na własnych zasadach. Poślubią mężczyzn możnych i zamożnych, lecz kochających, oddanych, rozważnych i romantycznych.","Kultura, Kino i TV",Rozważna i romantyczna
