url,heading,content,category,tags
https://www.vogue.pl/a/zlote-globy-2025-najgorsze-stylizacje-gwiazd-z-czerwonego-dywanu,Najbardziej nietrafione stylizacje gwiazd z gali Złotych Globów 2025,"Ceremonia rozdania Złotych Globów 2025za nami. W gronie laureatów znaleźli się twórcy filmu „Emilia Pérez”,Demi Moorei gwiazdy serialu „Szogun”. Gala Złotych Globów to nie tylko święto kina i telewizji, ale również mody. Na czerwonym dywanie błyszczała tego wieczora plejada gwiazd, w tym Zendaya,Angelina Jolie z córką, Timothée Chalamet,Ayo Edebiri, Selena Gomez i Cynthia Erivo. Na gali nie zabrakło również nietrafionych kreacji, jak casualowy garnitur Jeremy’ego Stronga czy mała czarna Fran Drescher.
","Moda, Zjawisko","Złote Globy, Złote Globy 2025, moda"
https://www.vogue.pl/a/56-letni-daniel-craig-przeszedl-metamorfoze-jego-nowy-styl-inspiruje-mlodych-mezczyzn,Nowy styl Daniela Craiga to największa metamorfoza roku,"James Bond radykalnie zmienił swój legendarny wizerunek. Perfekcyjnie skrojone garnitury i wytworne smokingi poszły w odstawkę. Do garderoby agenta MI6 trafiły zaś oversize’owe spodnie cargo, wielkie wełniane swetry, kolorowe kardigany, znoszone kurtki pilotki, sneakersy i doprawdy imponująca kolekcja awiatorów. Można by nawet rzec, że Bond umarł, ale za to narodził się Daniel Craig. Pozostaje tylko jedno pytanie. Czy nowy styl aktora rzeczywiście jest odbiciem jego osobowości, czy raczej świetną promocją jego nowego filmu – „Queer”?
## Umarł James Bond, niech żyje Daniel Craig
Paryż podczastygodnia modyto istna mekka fashionistów. Zjeżdżają niemal z całego świata i choć nie zawsze mają zaproszenia na pokazy, to i tak czują się jak na wybiegu. Bo robią show. Ich mniej lub bardziej ekscentryczne stylizacje skrzętnie dokumentują entuzjaścistreet fashion, których zdjęcia trafiają potem do prestiżowych portali i magazynów modowych, a nierzadko dyktują również trendy. Obok amatorów mody ulicznej uwagę fotoreporterów przyciągają też, oczywiście, gwiazdy. Im ważniejszy pokaz, tym większe nazwiska w pierwszym rzędzie.
## Styl na cool dziadka porywa zetki
Prezentacjanowej kolekcji Loewe, drugiej najbardziej pożądanej przez fashionistów marki na świecie (numerem jeden jest obecnie Miu Miu), była więc dla reporterów i paparazzi pewniakiem – tu nie mogło zabraknąć gwiazdorskiej pierwszej ligi. I rzeczywiście, zjawiły się takie osobowości, jak brytyjska it-girl Alexa Chung, top modelka Karlie Kloss, aktorka Ayo Edebiri znana z „The Bear” czy Josh O'Connor, niegdyś wcielający się w młodego księcia Karola w serialu „The Crown”, a ostatnio w Patricka Zweiga w głośnych „Challengers”. Ale największym zainteresowaniem bez wątpienia cieszył sięDaniel Craig, a dokładniej – jego look.
## Pożegnanie tradycyjnego modelu męskości
56-letni Daniel Craigprzez przeszło 15 lat wcielał się w Jamesa Bonda. A z czego, poza miłością do drinka Vesper Martini („wstrząśnięte, niemieszane!”) i pięknych kobiet, zasłynął agent 007? Z wytrawnego stylu, oczywiście. Eleganckie smokingi od Toma Forda, jedwabne muchyTurnbull & Asser, zegarek Omega, stalowoszare garnitury podkreślające niebieską tęczówkę oczu czy klasyczne trencze włoskiej marki Massimo Alba – oto kwintesencja męskiej klasyki w najlepszym wydaniu.","Moda, Zjawisko","Daniel Craig, Loewe, Natalia Hołownia, moda męska"
https://www.vogue.pl/a/czy-alkohol-w-kosmetykach-szkodzi-skorze-ktory-jest-dobry-a-ktory-zly,Dobry i zły. Cała prawda o alkoholu w kosmetykach,"Najczęściej pojawia się w tonikach oraz jako konserwant w kosmetykach naturalnych. To składnik, dzięki któremu formuły kremów są lżejsze i który wspiera przenikanie substancji aktywnych. W jaki sposób alkohol zawarty w kosmetykach i perfumach wpływa na skórę i czy należy się go obawiać?
## Jak kosmetyki z alkoholem wpływają na stan skóry?
Wiele osóbrezygnuje z picia alkoholu, świadomie wybierając napoje bez procentów. Natomiast alkohol etylowy, czyli etanol, jest także składnikiem kosmetycznym. Przez lata zyskał istotne miejsce na liście komponentów INCI dzięki swoim różnorodnym właściwościom i zastosowaniu. Niełatwo go zastąpić innymi substancjami.–Dodatek etanolu do receptury kosmetyku poprawia jego właściwości użytkowe (aplikacyjne), tzn. ułatwia rozprowadzanie produktu na twarzy lub ciele, zmniejsza efekt „bielenia” emulsji kosmetycznych podczas rozsmarowywania (np. w kremach, balsamach), niweluje odczucie kleistości produktu (zmniejsza lepkość) oraz minimalizuje pienienie się kosmetyku –mówi Marta Wiąckowska, senior scientific & regulatory affairs manager z Polskiego Związku Przemysłu Kosmetycznego. Natomiast zdarza się, że alkohol obecny w kremach, balsamach czy innych produktach przesusza skórę, wywołuje podrażnienia i zaczerwienienia. Czy należy do niego w związku z tym podchodzić z rezerwą? I jak naprawdę działa etanol lub jego „krewni” na cerę?
## Czy należy unikać alkoholi w kosmetykach?
Kontrowersje związane z alkoholem w kosmetykach dotyczą m.in. jego działania wysuszającego skórę. Naskórek, którego zewnętrzną powłoką jest warstwa rogowa o zwartej budowie złożonejz lipidów i cementu międzykomórkowego, ma zadanie zapobiegaćutracie wodyze skóry. Stanowi silną ochronę przed czynnikami zewnętrznymi, ale nie jest niezniszczalny. Zmiana jej struktury przekłada się na upośledzenie funkcji barierowej skóry, w konsekwencji na utratę wody i wysuszenie naskórka. A to sytuacja znajoma, zwłaszcza w sezonie grzewczym.
## Jaką rolę alkohol odgrywa w transportowaniu składników kosmetycznych?
–Alkohole niskocząsteczkowe w formułach kosmetycznych, takie jak alkohol etylowy (INCI: Alcohol/Ethanol/Ethyl Alcohol), zamiennie z alkoholem denaturowanym (INCI: Alcohol Denat) czy izopropylowym (INCI: Isopropyl Alcohol), mogą naruszać naturalną barierę lipidową skóry (zwłaszcza suchej, wrażliwej lub atopowej), prowadząc do utraty wilgoci i podrażnień. Osoby z tłustą skórą czasem tolerują alkohol w kosmetykach lepiej, ponieważ pomaga on m.in. kontrolować wydzielanie sebum– mówi dr nauk chemicznych Kajetan Dąbrowa z Kliniki Dr Chlebus.
## Alkohol w perfumach
Niekoniecznie. Alkohole tłuszczowe (np. Cetyl Alcohol, Stearyl Alcohol) są emolientami i wykazują działanie nawilżające oraz zmiękczające, wspomagając regenerację bariery ochronnej skóry. Dlatego jeśli jest ona sucha, warto uważać na ten denaturowany, etylowy czy izopropylowy w składzie. Mogą one niepotrzebnie podrażnić, a nawet wywołać miejscowe zaczerwienienie czy złuszczanie się naskórka. Natomiast zwykle ich obecność w składzie INCI nie powinna stanowić dla niej żadnego problemu. Zresztą diabeł tkwi w szczegółach, a konkretnie – w stężeniach. –Badania wykazały, że preparaty o stężeniu etanolu wynoszącym 20 proc. nie powodują zmian w strukturze warstwy rogowej, tj. nie wpływają na ubytek lipidów cementu międzykomórkowego, a w konsekwencji nie powodują znacznego wysuszania skóry– mówi Marta Wiąckowska. Jak podkreśla ekspertka z PZPK, szybko wyparowuje – kilkadziesiąt sekund po nałożeniu na skórę. Aby alkohol mógł rzeczywiście ją podrażnić, musiałby być w kontakcie ze skórą przez długi czas i występować w wyższych stężeniach.","Uroda, Trendy",Maria Kowalczyk/Nostressbeauty
https://www.vogue.pl/a/angielska-aktorka-keira-knightley-i-muzyk-james-righton-od-kilkunastu-lat-tworza-szczesliwy-zwiazek-i-rodzine,Keira Knightley najlepiej czuje się w domu z ukochanym Jamesem Rightonem i córkami,"Keira Knightley i James Righton pobrali się w 2013 roku. Wspólnie wychowują dwie córki. Rodzicielstwo uważają za ważniejsze od kariery. Kiedy się poznali? Co ich łączy? Jak wygląda ich codzienne życie?
## Keira Knightley wcześniej związana była z Jamiem Dornanem i Rupertem Friendem
ChoćKeira Knightleynie szukała miłości, jej menedżer wiedział, że czeka ją przełom. –Powiedział mi: „Śniło mi się, że w tym tygodniu spotkasz swojego przyszłego męża”. „Super”, pomyślałam. A że dostałam wtedy mnóstwo zaproszeń na rozmaite eventy, to postanowiłam pójść na każdy i się przekonać –wspominała gwiazda w podcaście iHeart. Jamesa Rightona, klawiszowca brytyjskiego zespołu The Klaxons, spotkała w niedzielę. Przedstawił się aktorce słowami: –Cześć, będę twoim mężem. I dokładnie tak się stało.
## Keira Knightley zakochała się w Jamesie Rightonie,  klawiszowcu Klaxons, bo potrafił ją rozbawić
Wcześniej Knightley była w kilku poważnych związkach.W latach 2003-2005 spotykała się z Jamiem Dornanem, czyli pamiętnym Christianem Greyem, a tuż przed spotkaniem z muzykiem zakończyła trwającą pięć lat relację z aktorem Rupertem Friendem. Miała ledwie 26 lat, na koncie takie filmy, jak „Piraci z Karaibów”,„To właśnie miłość”, „Duma i uprzedzenie” czy „Pokuta”  oraz nominację do Oscara, co zapewniło jej pozycję niekwestionowanej gwiazdy Hollywood. Po kilku intensywnych latach w Los Angeles Knightley wróciła odpocząć do rodzinnego Londynu. Została jednak zdecydowanie dłużej, niż planowała. A wszystko przez miłość.
## Keira Knightley poślubiła Jamesa Rightona w 2013 roku na południu Francji
–Byłam akurat na eleganckim przyjęciu, gdzie oglądaliśmy rozdanie Oscarów– opowiadała aktorka. –Nie chciałam iść, trochę się do tego zmusiłam. W końcu miałam spotkać przyszłego męża, prawda? Już po chwili wiedziałam, że na tej nudnej imprezie na pewno go nie ma. Wtedy zadzwonił mój totalnie pijany kolega, Tim Phillips, i zaczął wrzeszczeć do słuchawki. Zapowiedział, że zaraz wpadnie po mnie z kolegami. Byłam przerażona, bo nie był to raczej event dla Tima i jego ekipy– śmiała się Knightley. Ostatecznie się spotkali, a Keira poznała Jamesa. –I tu chciałabym wyjaśnić, że przedstawił nas sobie właśnie Tim, a nieAlexa Chung– żartowała aktorka. –Bo często czytamy w mediach, że poznaliśmy się dzięki Alexie.
## Keira i James doczekali się dwóch córek. Oboje nie gonią za karierą. Rodzina jest dla nich najważniejsza
Choć od 2007 roku The Klaxons utrzymywali się na szczycie, Knightley nie miała pojęcia, kim jest Righton. Od razu wydał jej się za to zabawny, przystojny i uroczy. –James rozświetla swoją osobowością każdy pokój, do jakiego wchodzi– wyznała kiedyś. –Jest całkowitym przeciwieństwem mnie, introwertyczki, która zwykle siedzi sama gdzieś z boku. Jest też o wiele milszy niż ja.A jednak, mimo tych różnic, natychmiast między nimi kliknęło. Przegadali cały wieczór i umówili się na kolejne wspólne wyjście. A potem kolejne i kolejne.
## Keira Knightley i James Righton w 2023 roku świętowali 10. rocznicę ślubu
–Zanim się pobraliśmy, nasze randki składały się niemal wyłącznie z jedzenia i picia– śmiała się aktorka w podcaście. –A potem, gdy zaszłam w ciążę, zostało tylko jedzenie.W kwestiach kulinarnych sporo ich zresztą różni. –Któregoś dnia James spojrzał na mnie ze śmiertelnie poważną miną i powiedział: „Wiesz, jeśli chcesz, to możesz trzymać swój majonez w lodówce”. Wtedy zrozumiałam, że nasz związek wszedł w kolejny etap –śmiała się Knightley.","Ludzie, Portrety","Keira Knightley, James Righton, Love Stories, związki gwiazd, Natalia Hołownia"
https://www.vogue.pl/a/najwazniejsze-trendy-kulinarne-2025-roku-jemy-lekko-zdrowo-i-roslinnie,"Jemy ekologicznie, roślinnie i zdrowo. Oto najważniejsze trendy kulinarne 2025 roku","Kulinaria rządzą się trendami, sezonowymi modami i chwilowymi fascynacjami. To, co pojawia się na talerzu, jest odbiciem szerszych zjawisk i zmian społecznych. Wybieramy najważniejsze tendencje 2025 roku. Czego jemy mniej, a czego więcej? Jakich smaków próbujemy? Jakie restauracje pokochamy?
## Jedzenie dobre dla jelit
Coraz lepiej rozumiemy, jak kondycja naszego układu pokarmowego wiąże się np. z naszą odpornością, a nawet nastrojem. Dlatego zwracamy uwagę nie tylko na smak jedzenia, lecz również na to, czy jest ono dobre dla naszych jelit i mikrobiomu układu pokarmowego.
## … i dla głowy
Wśród trendów kulinarnych na przyszły rok opisywanych przez agencję Innova Market Insights jednym z najważniejszych wydaje się właśnie „jedzenie dobre dla jelit”. Oprócz suplementów na półkach zobaczymy więcej produktów wzbogaconych o pre- i probiotyki lub takich, których receptura (np. wzbogacenie o błonnik czy witaminę D) została opracowana, by wspierać działanie układu pokarmowego.
## Herbata zamiast kawy
Pojawi się także więcej produktów opartych na składnikach oddziałujących na nastrój. Jak przewiduje Institute of Food Technologists, młodsi konsumenci będą poszukiwać produktów, które mogą wpływać na ich nastrój, np. uspokajać lub przeciwnie – pobudzać, dzięki naturalnym składnikom, takim jak określone przyprawy, zioła, jadalne grzyby czy witaminy z grupy B. Co powiecie na napój, który ukoi przed snem, lub czekoladę z ziaren z etycznych upraw, która pomoże lepiej się skoncentrować przed egzaminem?
## Restauracje, które oferują holistyczne doświadczenie
Trzecia fala kawowej mody rozlała się po świecie – teraz pora na herbatę. Podobnie jak w przypadku kawy, będziemy chętnie szukać ulubionych rodzajów herbaty, zwracać uwagę na jej pochodzenie i sposób zbiorów, uczyć się niuansów smaku oraz wybierać ulubione metody parzenia. Jak przewidują eksperci sieci handlowej Whole Foods w swoim corocznym raporcie trendowym, herbaty – kiedyś funkcjonujące w świecie restauracji głównie jako ziołowy napój podawany na lepsze trawienie po zakończonym posiłku – coraz częściej zaczynają odgrywać rolę w trakcie jedzenia. Serwuje się je jako alternatywę dla wyselekcjonowanych przez sommeliera win czy innych napojów alkoholowych.
## Konieczny zwrot ku ekologii
Pokolenie milenialsów bardziej niż materialne przedmioty ceni sobie doświadczenia, a unikalność przedkłada ponad stereotypowy luksus. Dlatego w trendzie będą restauracje, które oferują nie tylko ekskluzywne posiłki, lecz także holistyczne przeżycie. Może to być restauracja w odludnej części Himalajów (jak np. indyjska Naar, którą magazyn „Time” umieścił na liście najwspanialszych miejsc na świecie), taka, do której trzeba dopłynąć łodzią (Ocya w Rio de Janeiro), lub ulokowana na środku fiordu, jak np. norweska restauracja Iris. Fine dining, obudowany elementem podróży oraz wyjątkowej lokalizacji, może być połączony z noclegiem i zakończony śniadaniem z nieziemskim widokiem.
## Kuchnia naprawdę roślinna
Zwracamy uwagę na codzienne czynności, które mogą zmniejszać wpływ człowieka na środowisko naturalne. To już nie moda, ale konieczność. Choć trendless wasteczyno waste(niemarnowanie produktów) nie jest niczym nowym, to możliwości na tym polu się nie kończą. Ceramika zrobiona z recyklingowanych materiałów, ograniczenie plastiku w kuchni, wina pakowane w puszki zamiast w butelki (lżejsze, a przez to z mniejszym śladem węglowym) – każda mała rzecz się liczy. A my, jako goście, będziemy to doceniać i inspirować się tym, co można zrobić w domu.
## Spożywamy mniej cukru i alkoholu
Trendy z natury mają długofalowy charakter. Jednym z nich jest „uroślinnienie” naszej diety. W 2025 roku coraz częściej będziemy sięgać po naturalne, nieprzetworzone produkty roślinne, które zapewniają pożądaną dawkę białka i innych substancji odżywczych. Myślmy o strączkach, takich jak soczewica czy różne odmiany fasoli, i mniej oczywistych składnikach, jak np. wodorosty, które są bogate nie tylko w białko, lecz także cenny jod. Chętniej spojrzymy na jedzenie po prostu roślinne, nieprzetworzone i wykorzystujące całe produkty w ich naturalnej postaci – tak piękne, jak stworzyła je przyroda.
## Łączenie smaków
Według firmy badawczej Mintel już 40 proc. konsumentów jest skłonnych wybierać wersje produktów o obniżonej zawartości cukru. Trend ten dotrze nie tylko do sklepów, lecz także restauracji, w których szefowie kuchni będą poszukiwać alternatywnych źródeł słodyczy – z naturalnej słodyczy owoców czy warzyw. W pełni rozkwitnie też trend na napojenoilow alc– pozbawione lub zawierające minimalną ilość alkoholu. Są one coraz łatwiej dostępne zarówno w sklepach (w tym specjalistycznych), jak i lokalach. Ich asortyment jest coraz lepszej jakości, bardziej różnorodny (tak tak, nie jesteśmy już skazani wyłącznie na kombuchę) i zwyczajnie smaczny.","Styl życia, Kulinaria","trendy kulinarne, kuchnia roślinna, Małgorzata Minta, jedzenie"
https://www.vogue.pl/a/sesja-zdjeciowa-balmain-hair-z-okazji-50-urodzin-dla-vogue-polska,No Heading,"
","Premiery, Zjawisko, Historia, Pielęgnacja, Zdrowie, Zdrowie, Design, Sztuka, Kino i TV, Portrety, Portrety, Portrety, Kulinaria, Społeczeństwo, Miejsca, Makijaż i włosy","Agnieszka Zygmunt, Balmain Hair, włosy"
https://www.vogue.pl/a/kim-jest-chloe-sevigny-i-jak-stala-sie-slynna-it-girl,Chloë Sevigny jest tylko jedna. Jak stała się słynną it-girl?,"Jest ikoną kina niezależnego, a jednocześnie porusza się w głównym nurcie. Mało komu udaje się utrzymać taką karierę przez tyle lat. Trzy dekady od debiutu branża mody wciąż ją kocha. Oto historiaChloë Sevigny.
## Chloë Sevigny buntowniczka z wyboru
Jest bezpośrednia i bezpretensjonalna. Ma zaraźliwy śmiech i własną opinię na każdy temat. Lubi się wygłupiać, jest doskonałą towarzyszką imprez, a przy tym zakochaną w swoim synku mamą. Na pewno nie wydaje się nudna. Chloë Sevigny zadebiutowała w latach 90. i w niewytłumaczalny dla wielu sposób wciąż udaje jej się kontynuować karierę, zachowując przy tym niezależność. Potrafi być jednocześnie gwiazdą i outsiderką. Właśnie została twarzą kampanii Saint Laurent i zagrała w serialach„Konflikt: Capote kontra socjeta”i „Potwory: HistoriaLyle’a i Erika Menendezów”, pojawiła się także na okładkach niezliczonych magazynów. Niedawno skończyła 50 lat i wydaje się, że świat odkrywa ją wciąż na nowo. Nie będzie przesadą, gdy napiszę, że nie ma drugiej takiej jak ona.
## Nowojorska it girl
Sevigny nigdy nie ukrywała, że była problematyczną nastolatką. Urodziła się w Springfield w stanie Massachusetts, ale dorastała w zamożnej miejscowości Darien w Connecticut. Jej rodzina borykała się jednak z sytuacją finansową, dlatego Chloë zawsze wykonywała „bad teen job”. W dodatku państwo Sevignych – hipisów – oraz ich dwójkę bezstresowo wychowywanych dzieci uznawano za raczej niekonwencjonalnych na tle ułożonej i spokojnej społeczności.
## Chloë Sevigny Ikona stylu
Mama Janine, mająca polskie pochodzenie (z domu Malinowski), była zatrudniona w przykościelnym przedszkolu, następnie w sklepie papierniczym. Ojciec aktorki, Harold, zmarł, gdy ta miała 22 lata. Od tamtej pory Chloë wspiera mamę finansowo. Dorastała w wierze katolickiej, o czym wspomniała po latach przy okazjiswojego ślubu z Sinišą Mačkovićem(dyrektorem galerii sztuki w NYC), który wzięła w kościele w rodzinnej miejscowości. –Zawsze chciałam wyjść za mąż w tym właśnie miejscu– powiedziała amerykańskiemu „Vogue’owi”. To o tyle zaskakujące, że przez długi czas mało kto wyobrażał sobie, iż naczelna imprezowiczka Nowego Jorku może się ustatkować.","Ludzie, Portrety","Chloë Sevigny, Ismena Dąbrowska"
https://www.vogue.pl/a/digitalsyndication-bezowy-sweter-damski-bezowy-golf-damski-albo-bezowy-kardigan-zima-2025-ma-odcien-caffe-latte,Ponadczasowy beżowy sweter w odcieniu caffè latte to nasz ulubiony model na zimę,"Klasyczne beżowe swetry zimą 2025 roku przyjmują barwę caffè latte. Idealne beżowe swetry pasują i na randkę, i do pracy. Oto 15 najmodniejszych modeli, a wśród nich długi beżowy sweter,golfikardigan.
## Dopasowane beżowe swetry przyjmują barwę kawy z mlekiem
Brązi beż to najmodniejsze kolory zimy 2025 roku. Z ich połączenia powstaje ciepły, elegancki i wyrafinowany odcień caffè latte.
## W kolekcji każdej popularnej marki znajdziesz beżowe swetry
A post shared by Livia Auer (@livia_auer)","Moda, Selekcje","moda, trendy, swetry, Lucrezia Malavolta"
https://www.vogue.pl/a/trend-na-odchudzenie-brzucha-olejem-rycynowym-jak-i-czy-dziala,Olej rycynowy jako remedium na płaski brzuch. Weryfikujemy trend z TikToka,"Czy olej rycynowy wlewany do pępka sprawi, że brzuch będzie szczuplejszy, znikną objawy IBS i wszelkie bolączki związane z trawieniem? Tak twierdzą tiktokerki, których filmiki z olejowania tej partii ciała (a także picia oleju rycynowego) są już wiralem. Tym razem naprawdę warto wiedzieć, co twierdzą na ten temat eksperci.
## Olej rycynowy według TikToka ma pomagać na płaski brzuch. Czy takie jego działanie jest potwierdzone?
Wiralowe trendybywają zabawne, irracjonalne, czasami pożyteczne. Makijażowe, jak aplikacja eyelinera z pomocą taśmy klejącej, „grożą” ewentualnie krzywo pomalowaną kreską. Pielęgnacyjne, jak smarowanie twarzy kwasem i traktowanie jej rollerem zakończonym mikroigiełkami, mogą nieść poważniejsze konsekwencje, jak leczenie przebarwień czy trądziku. Dlatego trend z TikToka z masażem brzucha olejem rycynowym w celu posiadania bardziej płaskiego, poprawy metabolizmu, nawilżenia skóry, postanowiłam zweryfikować w rozmowie z ekspertkami: specjalistką ajurwedyjską Wandą D’Onofrio (@wanda_wander_with_wonder) i dr n. med. Agnieszką Nalewczyńską (@drnalewczynska).
## Olej rycynowy przyjmowany doustnie: Trucizna czy remedium?
Wlewanie oleju rycynowego do pępka i masowanie jego okolicy opuszkami palcaów na 10-sekundowym nagraniu Mirandy Wilson, ma na TikToku już kilka milionów odsłon. Powód: click baitowe hasło, bo płaski brzuch i wąska talia są wciąż tak bardzo pożądane mimoruchu ciałopozytywnościowego. Należy jednak pamiętać, że kształt brzucha ulega zmianom nawet w ciągu dnia, jest on bowiem podatny na wzdęcia, problemy czy choroby gastryczne, jak np. zespół jelita drażliwego. Rzadko bywa płaski.
## Jak olej rycynowy naprawdę działa na skórę?
Okazuje się, że Miranda Wilson nie wynalazła recepty na talię osy, bo źródło zabiegu jest bardzo stare iznane z ajurwedy. Tradycyjna medycyna indyjska od tysięcy lat stawia duży nacisk na olejowanie ciała. Według ajurwedy oleje przenikają przez skórę i mają działanie lecznicze (choć przenikanie cząsteczek oleju jest sprzeczne z medycyną zachodnią, o czym więcej w dalszej części artykułu). –Olej rycynowy stosowany jest w celach leczniczych, w zabiegu zwanym Nabhi Basti, czyli kąpieli olejowej wokół pępka. Pępek (nabhi) jest ważnym punktem w energetycznej strukturze oraz miejscem przepływu życiowej energii (prany). Często przy zaparciach czy wzdęciach polecam masowanie brzucha oraz wlanie paru kropli oleju rycynowego do pępka. Codzienny masaż brzucha zgodnie ze wskazówkami zegara wspiera trawienie i poprawia pracę układów wewnętrznych, rozluźnia i niweluje napięcie mięśniowe spowodowane stresem– mówi Wanda D’Onofrio, specjalistka ajurwedy, która prowadzi ajurwedyjskie konsultacje oraz organizuje wyjazdy na panchakarmę do Indii.","Uroda, Zdrowie","zdrowie, olejki, Masaż, Maria Kowalczyk/Nostressbeauty"
https://www.vogue.pl/a/serial-netflixa-wzgorze-psow-na-podstawie-powiesci-jakuba-zulczyka-to-thriller-dla-widzow-o-mocnych-nerwach,"Mocny serial Netflixa „Wzgórze psów” to przypowieść o zbrodni, złu i zemście","Utytułowani reżyserzy, Piotr Domalewski („Cicha noc”,„Hiacynt”) i Jacek Borcuch („Słodki koniec dnia”,„Warszawianka”), wzięli na warsztat powieśćJakuba Żulczyka„Wzgórze psów”. Tak powstała pierwsza przebojowa produkcja Netflixa na 2025 rok. Akcja serialu zabiera widzów do prowincjonalnego Zyborka, gdzie zło czai się na każdym kroku. Ten thriller dla widzów o mocnych nerwach trzeba obejrzeć do ostatniej sceny, bo każdy zwrot akcji zaskakuje.
","Kultura, Kino i TV","Wzgórze Psów, Jakub Żulczyk, Netflix"
